{
  "schemaVersion": "1.0",
  "meta": {
    "targetKind": "requirement",
    "target": "REQ-001",
    "reviewedAt": "2026-07-19T00:00:00Z",
    "agent": "test-agent",
    "scoringMethod": "logits",
    "repeatTimes": 3,
    "varianceThreshold": 0.1
  },
  "subCriteria": [
    {
      "name": "completeness",
      "weight": 0.3,
      "score": 0.9,
      "rawScores": [0.89, 0.9, 0.91],
      "variance": 0.0000667,
      "evidence": "requirements.md:§3.2=REQ-001 需求覆盖"
    },
    {
      "name": "clarity",
      "weight": 0.25,
      "score": 0.85,
      "rawScores": [0.84, 0.85, 0.86],
      "variance": 0.0000667,
      "evidence": "requirements.md:§3.2=REQ-001 需求覆盖"
    },
    {
      "name": "consistency",
      "weight": 0.2,
      "score": 0.88,
      "rawScores": [0.87, 0.88, 0.89],
      "variance": 0.0000667,
      "evidence": "requirements.md:§3.2=REQ-001 需求覆盖"
    },
    {
      "name": "testability",
      "weight": 0.15,
      "score": 0.8,
      "rawScores": [0.79, 0.8, 0.81],
      "variance": 0.0000667,
      "evidence": "requirements.md:§3.4=REQ-001 需求覆盖"
    },
    {
      "name": "traceability",
      "weight": 0.1,
      "score": 0.95,
      "rawScores": [0.94, 0.95, 0.96],
      "variance": 0.0000667,
      "evidence": "rtm.json:§REQ-001=coverage full"
    }
  ],
  "compositeScore": 0.8735,
  "qualityLevel": "A",
  "summary": "REQ-001 需求覆盖完整（5 子标准），采用 RBAC 权限模型，可测试可追溯，遗留风险：无，待运行时验证。",
  "passed": true,
  "reviewedArtifacts": [
    {
      "path": "README.md",
      "sha256": "a35fac32af8cbc699ce688520a61c41730517bab894f5d21d3ec91207e6d258d"
    }
  ]
}
