{
  "schemaVersion": "1.0",
  "meta": {
    "targetKind": "rootcause",
    "target": "RC-phase5-1-01",
    "reviewedAt": "2026-08-12T00:00:00Z",
    "agent": "test-agent",
    "scoringMethod": "logits",
    "repeatTimes": 3,
    "varianceThreshold": 0.1
  },
  "subCriteria": [
    {
      "name": "correctness",
      "weight": 0.25,
      "score": 0.9,
      "rawScores": [0.89, 0.9, 0.91],
      "variance": 0.0000667,
      "evidence": "src\\mod\\a.ts:L3=rootCauseChain[0].evidence 支持该步 answer"
    },
    {
      "name": "completeness",
      "weight": 0.25,
      "score": 0.85,
      "rawScores": [0.84, 0.85, 0.86],
      "variance": 0.0000667,
      "evidence": "D:\\proj\\rootcause.json:L1-5=rootCauseChain 共 3 步触及根本原因"
    },
    {
      "name": "falsifiability",
      "weight": 0.2,
      "score": 0.88,
      "rawScores": [0.87, 0.88, 0.89],
      "variance": 0.0000667,
      "evidence": "rootcause.json:§4.4=falsifiabilityCheck 含若…则可验证假设"
    },
    {
      "name": "actionability",
      "weight": 0.15,
      "score": 0.8,
      "rawScores": [0.79, 0.8, 0.81],
      "variance": 0.0000667,
      "evidence": "rootcause.json:§5.1=fixRecommendation[0] 含 target/location/action/rationale 四字段"
    },
    {
      "name": "prevention",
      "weight": 0.15,
      "score": 0.95,
      "rawScores": [0.94, 0.95, 0.96],
      "variance": 0.0000667,
      "evidence": "rootcause.json:§5.2=prevention[0] 含 scope/measure/owner 三字段"
    }
  ],
  "compositeScore": 0.876,
  "qualityLevel": "A",
  "summary": "C11 Windows 路径 evidence 正例（反斜杠 src\\mod\\a.ts:L3= 与盘符前缀 D:\\proj\\rootcause.json:L1-5=），rootcause 子标准集合与权重同 valid-rootcause.json，应通过全部校验。",
  "passed": true,
  "reviewedArtifacts": [
    {
      "path": "README.md",
      "sha256": "a35fac32af8cbc699ce688520a61c41730517bab894f5d21d3ec91207e6d258d"
    }
  ]
}
