{
  "schemaVersion": "1.0",
  "meta": {
    "targetKind": "rootcause",
    "target": "RC-phase5-1-01",
    "reviewedAt": "2026-08-12T00:00:00Z",
    "agent": "test-agent",
    "scoringMethod": "logits",
    "repeatTimes": 3,
    "varianceThreshold": 0.1
  },
  "subCriteria": [
    {
      "name": "correctness",
      "weight": 0.25,
      "score": 0.9,
      "rawScores": [0.89, 0.9, 0.91],
      "variance": 0.0000667,
      "evidence": "rootcause.json:§4.2=rootCauseChain[0].evidence 支持该步 answer"
    },
    {
      "name": "completeness",
      "weight": 0.25,
      "score": 0.85,
      "rawScores": [0.84, 0.85, 0.86],
      "variance": 0.0000667,
      "evidence": "rootcause.json:§4.3=rootCauseChain 共 3 步触及根本原因"
    },
    {
      "name": "falsifiability",
      "weight": 0.2,
      "score": 0.88,
      "rawScores": [0.87, 0.88, 0.89],
      "variance": 0.0000667,
      "evidence": "rootcause.json:§4.4=falsifiabilityCheck 含若…则可验证假设"
    },
    {
      "name": "actionability",
      "weight": 0.15,
      "score": 0.8,
      "rawScores": [0.79, 0.8, 0.81],
      "variance": 0.0000667,
      "evidence": "rootcause.json:§5.1=fixRecommendation[0] 含 target/location/action/rationale 四字段"
    },
    {
      "name": "prevention",
      "weight": 0.15,
      "score": 0.95,
      "rawScores": [0.94, 0.95, 0.96],
      "variance": 0.0000667,
      "evidence": "rootcause.json:§5.2=prevention[0] 含 scope/measure/owner 三字段"
    }
  ],
  "compositeScore": 0.876,
  "qualityLevel": "A",
  "summary": "RC-phase5-1-01 根因链逻辑自洽（3 步追溯至根本原因），可证伪假设成立，修复建议与预防措施可执行，V 复审结论：通过。",
  "passed": true,
  "reviewedArtifacts": [
    {
      "path": "README.md",
      "sha256": "2dfe8de7b528a1673567de769e2c231817ba9fe765c87cda195cd3c92f316d14"
    }
  ]
}
